Title,Progress,Type,MAL_Score,AniList_Score,Genres,Notes,MAL_URL,AniList_URL,Current_MAL_Score,Current_AniList_Score,Average_Score
Zom 100: Bucket List of the Dead,0/12,TV,7.66,7.7,"Action, Comedy, Horror, Supernatural, Survival",,FAILED_LOOKUP,FAILED_LOOKUP,,,
Stars Align,0/12,TV,7.66,7.7,"Drama, School, Slice of Life, Sports, Boys Love",,FAILED_LOOKUP,FAILED_LOOKUP,,,
Parallel World Pharmacy,0/12,TV,7.66,7.3,"Fantasy, Isekai",,FAILED_LOOKUP,FAILED_LOOKUP,,,
The World God Only Knows II,0/12,TV,7.65,8.1,"Comedy, Harem, Romance, Shounen, Supernatural",,FAILED_LOOKUP,FAILED_LOOKUP,,,
The Quintessential Quintuplets,0/12,TV,7.65,7.7,"Comedy, Harem, Romance, School, Shounen",,FAILED_LOOKUP,FAILED_LOOKUP,,,
Record of Grancrest War,0/24,TV,7.65,7.4,"Action, Drama, Fantasy",,FAILED_LOOKUP,FAILED_LOOKUP,,,
Pseudo Harem,0/12,TV,7.64,7.5,"Romance, School, Shounen",,FAILED_LOOKUP,FAILED_LOOKUP,,,
KamiKatsu: Working for God in a Godless World,0/12,TV,7.64,6.4,"Action, Comedy, Fantasy, Isekai",,FAILED_LOOKUP,FAILED_LOOKUP,,,
The Troubled Life of Miss Kotoura,0/12,TV,7.63,7.3,"Comedy, Drama, Romance, School",,FAILED_LOOKUP,FAILED_LOOKUP,,,
The Familiar of Zero: Rondo of Princesses,0/12,TV,7.62,7.5,"Action, Adventure, Comedy, Ecchi, Fantasy, Romance, School",,FAILED_LOOKUP,https://anilist.co/anime/14467,,,
The Familiar of Zero F,0/12,TV,7.62,7.7,"Adventure, Comedy, Ecchi, Fantasy, Magic, Romance, School",,FAILED_LOOKUP,FAILED_LOOKUP,,,
Sasaki and Miyano,0/12,TV,7.62,8.4,"Boys Love, Slice of Life, Romance, School",,FAILED_LOOKUP,FAILED_LOOKUP,,,
Ron Kamonohashi's Forbidden Deductions Season 2,0/13,TV,7.62,TBD,"Mystery, Shounen",[2024+] Upcoming,UNRELEASED,UNRELEASED,Unrated,Unrated,
Mushoku Tensei: Jobless Reincarnation Cour 2 - Eris the Goblin Slayer,0/1,Special,7.62,8.2,"Adventure, Drama, Fantasy, Ecchi, Magic, Isekai",,FAILED_LOOKUP,FAILED_LOOKUP,,,
Masamune-kun's Revenge R,0/12,TV,7.62,7,"Comedy, Harem, Romance, School, Shounen",,FAILED_LOOKUP,FAILED_LOOKUP,,,
Blood Blockade Battlefront,0/12,TV,7.62,7.7,"Action, Comedy, Fantasy, Supernatural, Vampire",,FAILED_LOOKUP,FAILED_LOOKUP,,,
World's End Harem,0/11,TV,7.61,6.1,"Drama, Ecchi, Harem, Sci-Fi, Seinen",,FAILED_LOOKUP,FAILED_LOOKUP,,,
The Kingdoms of Ruin,0/12,TV,7.61,6,"Action, Adventure, Drama, Fantasy, Magic, Sci-Fi, Shounen",,FAILED_LOOKUP,FAILED_LOOKUP,,,
Restaurant to Another World,0/12,TV,7.6,7.4,"Fantasy, Gourmet, Isekai, Slice of Life",,FAILED_LOOKUP,FAILED_LOOKUP,,,
Harem in the Labyrinth of Another World,0/12,TV,7.6,6.6,"Action, Adventure, Ecchi, Fantasy, Harem, Isekai",,FAILED_LOOKUP,FAILED_LOOKUP,,,
Brynhildr in the Darkness,0/13,TV,7.6,7,"Drama, Fantasy, Mystery, Romance, Sci-Fi, Seinen",,FAILED_LOOKUP,FAILED_LOOKUP,,,
Tales of Zestiria the X,0/13,TV,7.59,7.4,"Action, Adventure, Fantasy, Magic",,FAILED_LOOKUP,FAILED_LOOKUP,,,
PSYCHO-PASS 3,0/8,TV,7.59,7.5,"Action, Mystery, Police, Sci-Fi, Thriller",,FAILED_LOOKUP,FAILED_LOOKUP,,,
Our Dating Story: The Experienced You and The Inexperienced Me,0/12,TV,7.59,7.4,"Romance, School",,FAILED_LOOKUP,FAILED_LOOKUP,,,
By the Grace of the Gods,0/12,TV,7.58,6.9,"Adventure, Fantasy, Isekai, Slice of Life",,FAILED_LOOKUP,FAILED_LOOKUP,,,
?OSHI NO KO?Season 3,0/11,TV,7.58,TBD,"Drama, Reincarnation, Supernatural, Seinen",[2024+] Upcoming 2025,UNRELEASED,UNRELEASED,Unrated,Unrated,
ZENSHU,0/12,TV,7.57,TBD,"Romance, Slice of Life, Supernatural",[2024+] Winter 2025,FAILED_LOOKUP,FAILED_LOOKUP,,,
Akebi's Sailor Uniform,0/12,TV,7.57,7.6,"Slice of Life, School",,FAILED_LOOKUP,FAILED_LOOKUP,,,
Wotaku ni Koi wa Muzukashii OVA,0/3,OVA,7.56,8.1,"Comedy, Romance, Slice of Life",,FAILED_LOOKUP,FAILED_LOOKUP,,,
OniAi,0/12,TV,7.56,6.7,"Comedy, Ecchi, Harem, Romance, School",,FAILED_LOOKUP,FAILED_LOOKUP,,,
Knight's & Magic,0/13,TV,7.56,7.3,"Action, Fantasy, Magic, Mecha, School",,FAILED_LOOKUP,FAILED_LOOKUP,,,
Grimoire of Zero,0/12,TV,7.56,7.2,"Action, Adventure, Fantasy, Magic",,FAILED_LOOKUP,FAILED_LOOKUP,,,
Ben-To,0/12,TV,7.56,7.3,"Action, Comedy, Martial Arts, School",,FAILED_LOOKUP,FAILED_LOOKUP,,,
Beast Tamer,0/13,TV,7.56,6,"Action, Adventure, Comedy, Fantasy, Harem",,FAILED_LOOKUP,FAILED_LOOKUP,,,
The World God Only Knows: Goddesses,0/12,TV,7.55,8.1,"Comedy, Harem, Romance, Supernatural",,FAILED_LOOKUP,FAILED_LOOKUP,,,
The Pet Girl of Sakurasou,0/24,TV,7.55,7.6,"Comedy, Drama, Romance, School, Slice of Life",,FAILED_LOOKUP,FAILED_LOOKUP,,,
The Founder of Diabolism,0/15,ONA,7.55,8.8,"Action, Adventure, Boys Love, Comedy, Drama, Historical, Martial Arts, Supernatural, Xianxia",,FAILED_LOOKUP,FAILED_LOOKUP,,,
The Executioner and Her Way of Life,0/12,TV,7.55,6.5,"Action, Fantasy, Girls Love, Magic",,FAILED_LOOKUP,FAILED_LOOKUP,,,
Handyman Saitou in Another World,0/12,TV,7.55,7.3,"Adventure, Comedy, Fantasy, Isekai",,FAILED_LOOKUP,FAILED_LOOKUP,,,
Akiba Maid War,0/12,TV,7.55,7.9,"Action, Comedy, Drama",,FAILED_LOOKUP,FAILED_LOOKUP,,,
"The Fruit of Evolution: Before I Knew It, My Life Had It Made",0/12,TV,7.53,6.59,"6.7, Adventure, Comedy, Fantasy, Harem",,FAILED_LOOKUP,FAILED_LOOKUP,,,
PSYCHO-PASS: The Movie,0/1,Movie,7.53,7.8,"Action, Mystery, Police, Sci-Fi, Thriller",,FAILED_LOOKUP,FAILED_LOOKUP,,,
Shomin Sample,0/12,TV,7.51,7.4,"Comedy, Harem, Romance, School, Shounen",,FAILED_LOOKUP,FAILED_LOOKUP,,,
K: RETURN OF KINGS,0/13,TV,7.51,7.7,"Action, Magic, Supernatural",,FAILED_LOOKUP,FAILED_LOOKUP,,,
My Instant Death Ability is Overpowered,0/12,TV,7.5,7.4,"Adventure, Comedy, Fantasy, Isekai",,FAILED_LOOKUP,FAILED_LOOKUP,,,
Seirei Gensouki: Spirit Chronicles Season 2,0/12,TV,7.49,7.1,"Action, Adventure, Fantasy, Harem, Isekai, Romance",,FAILED_LOOKUP,FAILED_LOOKUP,,,
"I'm the Villainess, So I'm Taming the Final Boss",0/12,TV,7.49,7.85,"7.9, Comedy, Fantasy, Isekai, Romance, Shoujo, Villainess",,FAILED_LOOKUP,FAILED_LOOKUP,,,
Dimension W,0/12,TV,7.49,6.9,"Action, Sci-Fi, Seinen, Supernatural",,FAILED_LOOKUP,FAILED_LOOKUP,,,
RADIANT,0/21,TV,7.48,6.9,"Action, Adventure, Comedy, Fantasy, Magic, Shounen",,FAILED_LOOKUP,FAILED_LOOKUP,,,
Masamune-kun's Revenge,0/12,TV,7.48,7.5,"Comedy, Harem, Romance, School, Shounen",,FAILED_LOOKUP,FAILED_LOOKUP,,,
Darker than Black: Gemini of the Meteor,0/12,TV,7.48,7.5,"Action, Mystery, Sci-Fi, Supernatural",,FAILED_LOOKUP,FAILED_LOOKUP,,,
Blue Exorcist,0/25,TV,7.48,7.6,"Action, Demons, Fantasy, Shounen, Supernatural",,FAILED_LOOKUP,FAILED_LOOKUP,,,
Why Raeliana Ended Up at the Duke's Mansion,0/12,TV,7.47,7.5,"Fantasy, Romance, Isekai",,FAILED_LOOKUP,FAILED_LOOKUP,,,
Undead Murder Farce,0/13,TV,7.46,7.9,"Fantasy, Mystery, Supernatural",,FAILED_LOOKUP,FAILED_LOOKUP,,,
The Witch and the Beast,0/12,TV,7.46,7.9,"Action, Adventure, Drama, Fantasy, Seinen",,FAILED_LOOKUP,FAILED_LOOKUP,,,
The Qwaser of Stigmata,0/24,TV,7.46,6.5,"Action, Ecchi, Seinen, Supernatural",,FAILED_LOOKUP,FAILED_LOOKUP,,,
Seiren,0/12,TV,7.46,6.4,"Comedy, Romance, School",,FAILED_LOOKUP,FAILED_LOOKUP,,,
Ningen Fushin: Adventurers Who Don't Believe in Humanity Will Save the World,0/12,ONA,7.46,7,"Action, Adventure, Fantasy",,FAILED_LOOKUP,FAILED_LOOKUP,,,
Majikoi: Oh! Samurai Girls,0/12,TV,7.46,7,"Action, Comedy, Martial Arts, School, Harem",,FAILED_LOOKUP,FAILED_LOOKUP,,,
Love is Like a Cocktail,0/13,TV Short,7.45,7.1,"Comedy, Romance, Slice of Life",,FAILED_LOOKUP,FAILED_LOOKUP,,,
TONIKAWA: Over The Moon For You ~SNS~,0/1,OVA,7.44,7.9,"Comedy, Romance, Slice of Life",,FAILED_LOOKUP,FAILED_LOOKUP,,,
A Galaxy Next Door,0/12,TV,7.44,7.5,"Romance, Slice of Life, Supernatural",,FAILED_LOOKUP,FAILED_LOOKUP,,,
When Will Ayumu Make His Move?,0/12,TV,7.42,7.3,"Comedy, Romance, School, Slice of Life, Shounen",,FAILED_LOOKUP,FAILED_LOOKUP,,,
Peach Boy Riverside,0/12,TV,7.42,6.8,"Fantasy, Horror, Mystery, Shounen",,FAILED_LOOKUP,FAILED_LOOKUP,,,
Life With an Ordinary Guy Who Reincarnated Into a Total Fantasy Knockout,0/12,TV,7.42,7.1,"Adventure, Comedy, Fantasy, Isekai, Romance",,FAILED_LOOKUP,FAILED_LOOKUP,,,
Date A Live,0/12,TV,7.42,7.4,"Comedy, Harem, Mecha, Romance, School, Sci-Fi",,FAILED_LOOKUP,FAILED_LOOKUP,,,
TRIGUN STARGAZE,0/12,TV,7.41,TBD,"Action, Sci-Fi, Shounen",[2024+] Upcoming 2026?,UNRELEASED,UNRELEASED,Unrated,Unrated,
UQ Holder!,0/12,TV,7.4,7.2,"Action, Fantasy, Magic, Sci-Fi, Shounen, Supernatural",,FAILED_LOOKUP,FAILED_LOOKUP,,,
The Legend of the Legendary Heroes,0/24,TV,7.4,7.6,"Action, Adventure, Fantasy, Magic",,FAILED_LOOKUP,FAILED_LOOKUP,,,
Rurouni Kenshin (2023),0/24,TV,7.4,7.7,"Action, Comedy, Drama, Historical, Romance, Samurai",,FAILED_LOOKUP,FAILED_LOOKUP,,,
Chillin' in My 30s after Getting Fired from the Demon King's Army,0/12,TV,7.4,7.3,"Fantasy, Slice of Life",,FAILED_LOOKUP,FAILED_LOOKUP,,,
Seitokai Yakuindomo Season 2,0/13,TV,7.39,7.7,"Comedy, School, Shounen, Slice of Life",,FAILED_LOOKUP,FAILED_LOOKUP,,,
Infinite Dendrogram,0/13,TV,7.39,6.5,"Action, Fantasy, Game, Sci-Fi",,FAILED_LOOKUP,FAILED_LOOKUP,,,
Ron Kamonohashi's Forbidden Deductions,0/13,TV,7.38,7.5,"Mystery, Shounen",,FAILED_LOOKUP,FAILED_LOOKUP,,,
Kingdom,0/38,TV,7.38,8,"Action, Historical, Military, Seinen, War",,FAILED_LOOKUP,FAILED_LOOKUP,,,
Hitori no Shita - The Outcast,0/12,TV,7.38,6.6,"Action, Supernatural",,FAILED_LOOKUP,FAILED_LOOKUP,,,
K: MISSING KINGS,0/1,Movie,7.37,7.7,"Action, Magic, Supernatural",,FAILED_LOOKUP,FAILED_LOOKUP,,,
Honey Lemon Soda,0/12,TV,7.37,7.5,"Romance, School, Shoujo",,FAILED_LOOKUP,FAILED_LOOKUP,,,
Can a Boy-Girl Friendship Survive?,0/12,TV,7.37,7.4,"Comedy, Romance",,FAILED_LOOKUP,FAILED_LOOKUP,,,
Magical Warfare,0/12,TV,7.36,6.1,"Action, Fantasy, Magic",,FAILED_LOOKUP,FAILED_LOOKUP,,,
Love Lab,0/13,TV,7.36,7.5,"Comedy, Romance, School, Slice of Life",,FAILED_LOOKUP,FAILED_LOOKUP,,,
You are Ms. Servant,0/12,TV,7.35,7.4,"Comedy, Romance",,FAILED_LOOKUP,FAILED_LOOKUP,,,
The Foolish Angel Dances with the Devil,0/12,TV,7.35,7.2,"Comedy, Fantasy, Romance, Supernatural",,FAILED_LOOKUP,FAILED_LOOKUP,,,
Heaven's Lost Property: Forte,0/12,TV,7.34,7.7,"Comedy, Ecchi, Harem, Romance, Sci-Fi, Shounen, Supernatural",,FAILED_LOOKUP,FAILED_LOOKUP,,,
SSSS.DYNAZENON,0/12,TV,7.33,7.6,"Action, Mecha, Sci-Fi",,FAILED_LOOKUP,FAILED_LOOKUP,,,
Kakuriyo -Bed & Breakfast for Spirits-,0/26,TV,7.33,7.6,"Demons, Fantasy, Slice of Life, Supernatural",,FAILED_LOOKUP,FAILED_LOOKUP,,,
I've Somehow Gotten Stronger When I Improved My Farm-Related Skills,0/12,TV,7.33,6.7,"Action, Adventure, Comedy, Fantasy",,FAILED_LOOKUP,FAILED_LOOKUP,,,
Tawawa on Monday,0/12,ONA,7.32,7.1,"Comedy, Romance, Slice of Life",,FAILED_LOOKUP,FAILED_LOOKUP,,,
Kabaneri of the Iron Fortress: The Battle of Unato,0/1,Movie,7.32,7.8,"Action, Drama, Fantasy, Horror, Supernatural",,FAILED_LOOKUP,FAILED_LOOKUP,,,
I Have a Crush at Work,0/12,TV,7.32,7.4,"Romance, Slice of Life, Adult Cast",,FAILED_LOOKUP,FAILED_LOOKUP,,,
Granblue Fantasy: The Animation,0/13,TV,7.32,6.7,"Adventure, Fantasy",,FAILED_LOOKUP,FAILED_LOOKUP,,,
The Ones Within,0/12,TV,7.31,7,"Game, Mystery, Psychological",,FAILED_LOOKUP,FAILED_LOOKUP,,,
My Tiny Senpai,0/12,TV,7.31,7.5,"Comedy, Romance, Slice of Life",,FAILED_LOOKUP,FAILED_LOOKUP,,,
Medaka Kuroiwa is Impervious to My Charms,0/12,TV,7.31,7.4,"Comedy, Romance, School",,FAILED_LOOKUP,FAILED_LOOKUP,,,
Kubikiri Cycle: The Blue Savant and the Nonsense User,0/8,OVA,7.3,8,"Mystery, Supernatural",,FAILED_LOOKUP,FAILED_LOOKUP,,,
Made in Abyss: Wandering Twilight,0/1,Movie,7.29,8.2,"Adventure, Drama, Fantasy, Mystery, Sci-Fi, Seinen",,FAILED_LOOKUP,FAILED_LOOKUP,,,
Campfire Cooking in Another World with my Absurd Skill Season 2,0/12,TV,7.29,7.6,"Adventure, Fantasy, Gourmet",,FAILED_LOOKUP,FAILED_LOOKUP,,,
Spice and Wolf II: Wolf and the Amber Melancholy,0/1,OVA,7.28,8.1,"Adventure, Fantasy, Romance, Supernatural",,FAILED_LOOKUP,FAILED_LOOKUP,,,
Princess Lover!,0/12,TV,7.28,6.9,"Comedy, Ecchi, Harem, Romance, School, Supernatural",,FAILED_LOOKUP,FAILED_LOOKUP,,,
Helck,0/24,TV,7.28,7.5,"Action, Adventure, Comedy, Demons, Fantasy",,FAILED_LOOKUP,FAILED_LOOKUP,,,
TenPuru,0/12,TV,7.27,6.7,"Comedy, Ecchi, Harem, Romance, Slice of Life",,FAILED_LOOKUP,FAILED_LOOKUP,,,
RWBY: Ice Queendom,0/12,TV,7.27,6.4,"Action, Fantasy, Mahou Shoujo, Sci-Fi",,FAILED_LOOKUP,FAILED_LOOKUP,,,
I'm Giving the Disgraced Noble Lady I Rescued a Crash Course in Naughtiness,0/12,TV,7.27,7.7,"Comedy, Ecchi, Fantasy, Romance, Shoujo, Yuri",,FAILED_LOOKUP,FAILED_LOOKUP,,,
"Girlfriend, Girlfriend",0/12,TV,7.26,6.89,"7, Comedy, Harem, Romance, School, Shounen",,FAILED_LOOKUP,FAILED_LOOKUP,,,
ORIENT,0/12,TV,7.25,6.7,"Action, Fantasy, Shounen, Supernatural, Samurai",,FAILED_LOOKUP,FAILED_LOOKUP,,,
You and I Are Polar Opposites,0/12,TV,7.24,7.2,"Romance, School",,FAILED_LOOKUP,FAILED_LOOKUP,,,
Yona of the Dawn OVA,0/3,OVA,7.24,8.2,"Action, Adventure, Comedy, Fantasy, Romance, Shoujo",,FAILED_LOOKUP,FAILED_LOOKUP,,,
Made in Abyss: Journey's Dawn,0/1,Movie,7.24,8.2,"Adventure, Drama, Fantasy, Mystery, Sci-Fi, Seinen",,FAILED_LOOKUP,FAILED_LOOKUP,,,
The Moment You Fall in Love,0/1,Movie,7.23,7.3,"Romance, School",,FAILED_LOOKUP,FAILED_LOOKUP,,,
TONIKAWA: Over The Moon For You ~Uniform~,0/1,Special,7.23,7.9,"Comedy, Romance, Slice of Life",,FAILED_LOOKUP,FAILED_LOOKUP,,,
Recovery of an MMO Junkie OVA,0/1,OVA,7.23,7.3,"Comedy, Game, Romance, Slice of Life",,FAILED_LOOKUP,FAILED_LOOKUP,,,
Dawang Raoming,0/12,ONA,7.23,7,"Action, Fantasy",,FAILED_LOOKUP,FAILED_LOOKUP,,,
The Prince of Tennis,0/178,TV,7.22,7.9,"Action, Comedy, School, Shounen, Sports",,FAILED_LOOKUP,FAILED_LOOKUP,,,
Blue Orchestra Season 2,0/21,TV,7.22,TBD,"Music, School, Slice of Life",[2024+] Upcoming,UNRELEASED,UNRELEASED,Unrated,Unrated,
the Garden of sinners -recalled out summer-,0/1,Movie,7.21,7.5,"Mystery, Supernatural, Drama, Romance, Thriller",,FAILED_LOOKUP,FAILED_LOOKUP,,,
Tokidoki Bosotto Russiago de Dereru Tonari no Alya-san Season 2,0,TV,7.2,TBD,"Comedy, Romance, School","""""Tokidoki Bosotto Russiago de Dereru Tonari no Alya-san Season 2""""",FAILED_LOOKUP,FAILED_LOOKUP,,,
The Sacred Blacksmith,0/12,TV,7.2,6.8,"Action, Adventure, Fantasy",,FAILED_LOOKUP,FAILED_LOOKUP,,,
Sweet Reincarnation,0/12,ONA,7.2,6.3,"Fantasy, Gourmet, Isekai",,FAILED_LOOKUP,FAILED_LOOKUP,,,
Sound! Euphonium 3,0/13,TV,7.2,TBD,"Drama, Music, School, Hibike! Euphonium 3",[2024+] 2024,FAILED_LOOKUP,FAILED_LOOKUP,,,
PSYCHO-PASS: Sinners of the System 1 - Crime and Punishment,0/1,Movie,7.2,7.7,"Action, Mystery, Police, Psychological, Sci-Fi",,FAILED_LOOKUP,FAILED_LOOKUP,,,
Kaguya-sama: Love Is War -Stairway to Adulthood-,0/2,Special,7.2,8.5,"Comedy, Psychological, Romance",,FAILED_LOOKUP,FAILED_LOOKUP,,,
Love Live! Nijigasaki High School Idol Club,0/13,TV,7.19,7.3,"Music, School, Slice of Life, Idols",,FAILED_LOOKUP,FAILED_LOOKUP,,,
La Storia Della Arcana Famiglia,0/12,TV,7.19,6.3,"Action, Harem, Romance, Shoujo",,FAILED_LOOKUP,FAILED_LOOKUP,,,
LAZARUS,0/13,TV,7.19,TBD,"Action, Sci-Fi",[2024+] Upcoming 2025,UNRELEASED,UNRELEASED,Unrated,Unrated,
Code Geass: Rozé of the Recapture,0/12,ONA,7.19,7.2,"Action, Drama, Mecha, Military, Sci-Fi",,FAILED_LOOKUP,FAILED_LOOKUP,,,
A Good Librarian Like a Good Shepherd,0/12,TV,7.19,6.6,"Comedy, Harem, Romance, School",,FAILED_LOOKUP,FAILED_LOOKUP,,,
Tearmoon Empire,0/12,TV,7.18,7.4,"Comedy, Drama, Fantasy, Romance",,FAILED_LOOKUP,FAILED_LOOKUP,,,
PSYCHO-PASS: Sinners of the System 2 - First Guardian,0/1,Movie,7.18,7.8,"Action, Mystery, Police, Psychological",,FAILED_LOOKUP,FAILED_LOOKUP,,,
PSYCHO-PASS 3: First Inspector,0/3,ONA,7.16,7.6,"Action, Mystery, Police, Psychological, Sci-Fi, Thriller",,FAILED_LOOKUP,FAILED_LOOKUP,,,
Migi&Dali,0/13,TV,7.16,7.9,"Comedy, Mystery, Slice of Life, Suspense",,FAILED_LOOKUP,FAILED_LOOKUP,,,
given: on the other hand,0/1,OVA,7.14,7.9,"Boys Love, Drama, Romance",,FAILED_LOOKUP,FAILED_LOOKUP,,,
RADIANT Season 2,0/21,TV,7.12,7.2,"Action, Adventure, Comedy, Fantasy, Shounen",,FAILED_LOOKUP,FAILED_LOOKUP,,,
Haven't You Heard? I'm Sakamoto: Haven't You Heard? I was Sakamoto,0/1,OVA,7.11,7.6,"Comedy, School, Seinen, Slice of Life",,FAILED_LOOKUP,FAILED_LOOKUP,,,
Darker than Black: Beneath Cherry Blossoms in Full Bloom,0/1,Special,7.11,7.6,"Action, Comedy, Mystery, Sci-Fi, Supernatural",,FAILED_LOOKUP,FAILED_LOOKUP,,,
ATRI -My Dear Moments-,0/13,TV,7.11,7.8,"Drama, Romance, Sci-Fi, Visual Novel",,FAILED_LOOKUP,FAILED_LOOKUP,,,
Isekai Quartet The Movie: Another World,0/1,Movie,7.1,7.3,"Comedy, Fantasy, Isekai, Parody",,FAILED_LOOKUP,FAILED_LOOKUP,,,
Flower and Asura,0/12,TV,7.10,TBD,"Sports, Hana wa Saku, Shura no Gotoku",[2024+] Upcoming,UNRELEASED,UNRELEASED,Unrated,Unrated,
Code Geass: Lelouch of the Rebellion III - Glorification,0/1,Movie,7.1,8.1,"Action, Drama, Mecha, Military, Sci-Fi, Super Power",,FAILED_LOOKUP,FAILED_LOOKUP,,,
Blue Archive The Animation,0/12,TV,7.1,7.1,"Action, Fantasy, School",,FAILED_LOOKUP,FAILED_LOOKUP,,,
Beheneko: The Elf-Girl's Cat is Secretly an S-Ranked Monster!,0/12,TV,7.1,6.8,"Comedy, Fantasy, Slice of Life",,FAILED_LOOKUP,FAILED_LOOKUP,,,
Shigurui: Death Frenzy,0/12,TV,7.09,7,"Action, Drama, Historical, Martial Arts, Seinen",,FAILED_LOOKUP,FAILED_LOOKUP,,,
Heaven's Lost Property the Movie: The Angeloid of Clockwork,0/1,Movie,7.09,7.6,"Comedy, Ecchi, Romance, Sci-Fi, Shounen, Supernatural",,FAILED_LOOKUP,FAILED_LOOKUP,,,
TONIKAWA: Over The Moon For You ~High School Days~,0/4,ONA,7.06,8,"Comedy, Romance, Slice of Life",,FAILED_LOOKUP,FAILED_LOOKUP,,,
Kingdom Season 2,0/39,TV,7.06,8.3,"Action, Historical, Military, Seinen, War",,FAILED_LOOKUP,FAILED_LOOKUP,,,
Sentenced to Be a Hero,0/12,TV,7.01,TBD,"Action, Fantasy",[2024+] Aired 2025,FAILED_LOOKUP,FAILED_LOOKUP,,,
The Red Ranger Becomes an Adventurer in Another World,0/12,TV,7,7,"Action, Adventure, Comedy, Fantasy, Isekai, Mecha",,FAILED_LOOKUP,FAILED_LOOKUP,,,
A Ninja and an Assassin Under One Roof,0/12,TV,7,6.7,"Comedy, Slice of Life",,FAILED_LOOKUP,FAILED_LOOKUP,,,
Aishen Qiaokeli-ING...,0/15,ONA,6.99,6.3,"Comedy, Harem, Romance, School",,FAILED_LOOKUP,FAILED_LOOKUP,,,
The Silver Guardian,0/12,TV,6.98,6.1,"Action, Adventure, Comedy, Fantasy, Game, Romance",,FAILED_LOOKUP,FAILED_LOOKUP,,,
Code Geass: Akito the Exiled - The Brightness Falls,0/1,Movie,6.97,7.5,"Action, Mecha, Military, Sci-Fi",,FAILED_LOOKUP,FAILED_LOOKUP,,,
Lycoris Recoil -Friends are thieves of time.-,0/6,ONA,6.96,7.4,"Action, Slice of Life",,FAILED_LOOKUP,FAILED_LOOKUP,,,
Code Geass: Lelouch of the Rebellion II - Transgression,0/1,Movie,6.96,7.9,"Action, Drama, Mecha, Military",,FAILED_LOOKUP,FAILED_LOOKUP,,,
Made in Abyss: Mezameru Shinpi,0/1,Movie,6.93,7.2,"Adventure, Drama, Fantasy, Mystery",,FAILED_LOOKUP,FAILED_LOOKUP,,,
Blue Orchestra,0/24,TV,6.93,7.7,"Music, School, Slice of Life",,FAILED_LOOKUP,FAILED_LOOKUP,,,
"There was a Cute Girl in the Hero's Party, so I Tried Confessing to Her",0/13,TV,6.92,7.2,"7.4, Adventure, Comedy, Fantasy, Romance",,FAILED_LOOKUP,FAILED_LOOKUP,,,
Kingdom Season 3,0/26,TV,6.91,8.2,"Action, Historical, Military, Seinen, War",,FAILED_LOOKUP,FAILED_LOOKUP,,,
Hakumei and Mikochi,0/12,TV,6.91,7.8,"Adventure, Fantasy, Slice of Life",,FAILED_LOOKUP,FAILED_LOOKUP,,,
Code Geass: Akito the Exiled - Memories of Hatred,0/1,Movie,6.9,7.4,"Action, Mecha, Military, Sci-Fi",,FAILED_LOOKUP,FAILED_LOOKUP,,,
Sasaki and Miyano: Graduation,0/1,Movie,6.89,8.2,"Boys Love, Romance, School",,FAILED_LOOKUP,FAILED_LOOKUP,,,
Moonrise,0/18,ONA,6.89,7.8,"Action, Sci-Fi, Space, Thriller",,FAILED_LOOKUP,FAILED_LOOKUP,,,
Hortensia SAGA,0/12,TV,6.88,5.9,"Action, Drama, Fantasy, Magic",,FAILED_LOOKUP,FAILED_LOOKUP,,,
Code Geass: Akito the Exiled - To Beloved Ones,0/1,Movie,6.88,7.6,"Action, Mecha, Military, Sci-Fi",,FAILED_LOOKUP,FAILED_LOOKUP,,,
Tales of the Abyss,0/26,TV,6.86,7.9,"Adventure, Drama, Fantasy, Magic",,FAILED_LOOKUP,FAILED_LOOKUP,,,
"Snow White with the Red Hair: Nandemonai Takaramono, Kono Page",0/1,Special,6.82,7.9,"Drama, Fantasy, Romance, Shoujo",,FAILED_LOOKUP,FAILED_LOOKUP,,,
Heroic Age,0/26,TV,6.79,7.4,"Action, Mecha, Military, Sci-Fi, Space",,FAILED_LOOKUP,FAILED_LOOKUP,,,
Heaven's Lost Property Final - The Movie: Eternally My Master,0/1,Movie,6.79,7.7,"Comedy, Ecchi, Romance, Sci-Fi, Shounen, Supernatural",,FAILED_LOOKUP,FAILED_LOOKUP,,,
Disney Twisted-Wonderland: THE ANIMATION - Season 1,0/8,ONA,6.79,6.5,"Fantasy, Game, Isekai, School, Josei",,FAILED_LOOKUP,FAILED_LOOKUP,,,
Dusk Maiden of Amnesia: Ghost Girl,0/1,OVA,6.78,7.7,"Horror, Romance, School, Shounen, Supernatural",,FAILED_LOOKUP,FAILED_LOOKUP,,,
Betrothed to My Sister's Ex,0/12,TV,6.76,7,"Comedy, Romance",,FAILED_LOOKUP,FAILED_LOOKUP,,,
PSYCHO-PASS: Providence,0/1,Movie,6.74,7.8,"Action, Mystery, Police, Sci-Fi, Suspense",,FAILED_LOOKUP,FAILED_LOOKUP,,,
ODDTAXI In The Woods,0/1,Movie,6.73,7.9,"Mystery, Drama, Slice of Life",,FAILED_LOOKUP,FAILED_LOOKUP,,,
given The Movie: Hiiragi Mix,0/1,Movie,6.71,8.2,"Boys Love, Drama, Music, Kingdom Season 4, 0/26, TV, 7.83, 8, Action, Historical, Military, Seinen, War",,FAILED_LOOKUP,FAILED_LOOKUP,,,
Love Live! Nijigasaki High School Idol Club Season 2,0/13,TV,6.71,7.5,"Music, School, Slice of Life, Idols",,FAILED_LOOKUP,FAILED_LOOKUP,,,
Zombie Land Saga: Yumeginga Paradise,0/1,Movie,6.7,7.5,"Comedy, Music, Supernatural, Idols",,FAILED_LOOKUP,FAILED_LOOKUP,,,
A Day Before Us,0/10,ONA,6.61,7.5,"Romance, Slice of Life",,FAILED_LOOKUP,FAILED_LOOKUP,,,
Isekai de Cheat Skill wo Te ni Shita Ore wa...,0/1,Special,6.6,6.5,"Action, Fantasy, Isekai",,FAILED_LOOKUP,FAILED_LOOKUP,,,
Kabaneri of the Iron Fortress: Life That Burns,0/1,Movie,6.58,7.4,"Action, Drama, Fantasy, Horror, Supernatural",,FAILED_LOOKUP,FAILED_LOOKUP,,,
Daemons of the Shadow Realm,0,TV,6.58,6.9,"Action, Adventure, Fantasy, Supernatural",,FAILED_LOOKUP,FAILED_LOOKUP,,,
Sacred Seven,0/12,TV,6.56,6.4,"Action, Sci-Fi, Super Power",,FAILED_LOOKUP,FAILED_LOOKUP,,,
The Silver Guardian 2,0/6,TV,6.53,6.6,"Action, Adventure, Comedy, Fantasy, Game, Romance",,FAILED_LOOKUP,FAILED_LOOKUP,,,
The Beginning After the End Season 2,0/12,TV,6.53,TBD,"Action, Adventure, Fantasy, Isekai, Reincarnation",[2024+] Upcoming,UNRELEASED,UNRELEASED,Unrated,Unrated,
Blood Blockade Battlefront: King of Kings,0/1,OVA,6.53,7.4,"Action, Comedy, Fantasy, Supernatural",,FAILED_LOOKUP,FAILED_LOOKUP,,,
Sasaki and Miyano: A Tiny Episode,0/1,OVA,6.52,7.8,"Boys Love, Romance, School",,FAILED_LOOKUP,FAILED_LOOKUP,,,
Kabaneri of the Iron Fortress: Light That Gathers,0/1,Movie,6.51,7.2,"Action, Drama, Fantasy, Horror, Supernatural",,FAILED_LOOKUP,FAILED_LOOKUP,,,
Yingxiong Zailin,0/12,ONA,6.5,7.5,"Action, Adventure, Fantasy",,FAILED_LOOKUP,FAILED_LOOKUP,,,
Kingdom Season 5,0/13,TV,6.5,8.1,"Action, Historical, Military, Seinen, War",,FAILED_LOOKUP,FAILED_LOOKUP,,,
Malevolent Spirits: Mononogatari Cour 2,0/12,TV,6.48,7.4,"Action, Fantasy, Historical, Mythology, Supernatural",,FAILED_LOOKUP,FAILED_LOOKUP,,,
Blood Blockade Battlefront & Beyond OVA,0/1,OVA,6.47,7.5,"Action, Comedy, Fantasy, Supernatural",,FAILED_LOOKUP,FAILED_LOOKUP,,,
April Showers Bring May Flowers,0/13,TV,6.46,7.1,"Comedy, School, Slice of Life",,FAILED_LOOKUP,FAILED_LOOKUP,,,
Touring After the Apocalypse,0/12,TV,6.45,7.2,"Adventure, Sci-Fi, Slice of Life",,FAILED_LOOKUP,FAILED_LOOKUP,,,
given The Movie: To the Sea,0/1,Movie,6.43,8.2,"Boys Love, Drama, Music, Romance",,FAILED_LOOKUP,FAILED_LOOKUP,,,
Dawang Raoming 2,0/12,ONA,6.42,7.3,"Action, Fantasy",,FAILED_LOOKUP,FAILED_LOOKUP,,,
"A Herbivorous Dragon of 5,000 Years Gets Unfairly Villainized",0/12,TV,6.42,6.62,"6.8, Comedy, Fantasy",,FAILED_LOOKUP,FAILED_LOOKUP,,,
Otherworld Harem Story,0/4,OVA,6.36,5.9,"Ecchi, Fantasy, Harem",,FAILED_LOOKUP,FAILED_LOOKUP,,,
Kakuriyo -Bed & Breakfast for Spirits- 2,0/12,TV,6.36,7.7,"Demons, Fantasy, Slice of Life, Supernatural",,FAILED_LOOKUP,FAILED_LOOKUP,,,
A Day Before Us ZERO,0/19,ONA,6.35,7.4,"Drama, Romance, Slice of Life",,FAILED_LOOKUP,FAILED_LOOKUP,,,
A Day Before Us 2nd Season,0/15,ONA,6.35,7.5,"Romance, Slice of Life",,FAILED_LOOKUP,FAILED_LOOKUP,,,
Kingdom Season 6,0/13,TV,6.34,8.4,"Action, Historical, Military, Seinen, War",,FAILED_LOOKUP,FAILED_LOOKUP,,,
Farmagia,0/12,TV,6.34,5.8,"Action, Adventure, Fantasy",,FAILED_LOOKUP,FAILED_LOOKUP,,,
Love Live! Nijigasaki High School Idol Club: NEXT SKY,0/1,OVA,6.33,7.6,"Music, School, Slice of Life, Idols",,FAILED_LOOKUP,FAILED_LOOKUP,,,
9-nine- Ruler's Crown,0/13,TV,6.33,5.9,"Ecchi, Fantasy, Harem, Romance, School",,FAILED_LOOKUP,FAILED_LOOKUP,,,
Plus-sized Misadventures in Love!,0/12,TV,6.29,7.5,"Comedy, Romance, Slice of Life",,FAILED_LOOKUP,FAILED_LOOKUP,,,
"Boku no Imouto wa """"Osaka Okan""""",0/12,TV Short,6.28,6.3,"Comedy, Slice of Life",,FAILED_LOOKUP,FAILED_LOOKUP,,,
SI-VIS: The Sound of Heroes,0/24,TV,6.25,TBD,"Action, Fantasy, Music","""""Saikyou no Shienshoku 'Wajutsushi' de Aru Ore wa Sekai Saikyou Clan ni Shitagaeru N desu ga""""?",FAILED_LOOKUP,FAILED_LOOKUP,,,
Princess Lover! Picture Drama,0/6,Special,6.16,5.9,"Comedy, Ecchi, Harem",,FAILED_LOOKUP,FAILED_LOOKUP,,,
Agate,0/15,ONA,6.15,6.5,"Action, Fantasy, Magic",,FAILED_LOOKUP,FAILED_LOOKUP,,,
Princess Lover!: Magical Knight Maria-chan,0/6,Special,6.12,5.9,"Comedy, Ecchi, Magic, Parody",,FAILED_LOOKUP,FAILED_LOOKUP,,,
Girls und Panzer: Motto Love Love Sakusen desu!,0/4,Movie,6.03,7.8,"Comedy, Military",,FAILED_LOOKUP,FAILED_LOOKUP,,,
Love Between Fairy and Devil,0/12,ONA,6.02,7.9,"Fantasy, Magic, Romance",,FAILED_LOOKUP,FAILED_LOOKUP,,,
Sacred Seven: Wings of the Silver Moon,0/1,Movie,5.88,6.4,"Action, Sci-Fi, Super Power",,FAILED_LOOKUP,FAILED_LOOKUP,,,
Strike World: Deadverse Reloaded the Anime,0/10,TV,5.87,TBD,"Action, Fantasy, Strike the Blood IV?",,FAILED_LOOKUP,FAILED_LOOKUP,,,
Style of Hiroshi Nohara's Lunch,0/12,TV,5.86,6.6,"Comedy, Kids, Slice of Life",,FAILED_LOOKUP,FAILED_LOOKUP,,,
Yuan Zun,0/26,ONA,5.85,TBD,"Action, Adventure, Fantasy, Martial Arts",,FAILED_LOOKUP,FAILED_LOOKUP,,,
Sacred Seven: Wings of the Silver Moon Picture Drama,0/2,Special,5.84,5.9,Comedy,,FAILED_LOOKUP,FAILED_LOOKUP,,,
Cang Lan Jue Part 2,0/12,ONA,5.83,7,"Action, Adventure, Drama, Fantasy, Martial Arts, Romance",,FAILED_LOOKUP,FAILED_LOOKUP,,,
